{
  "consultantSlug": "joel-holmberg",
  "language": "swedish",
  "assignmentId": "a7594",
  "assignmentTitle": "Senior Backendutvecklare Java",
  "variantId": "java-backend-ai",
  "variantLabel": "Java developer with AI",
  "sourceCv": "cvs/Axessibility_Lab_AB_Joel_Holmberg_Javautvecklare_med_AI.pdf",
  "contact": {
    "name": "Joel Holmberg",
    "email": "joel@axesslab.com",
    "phone": "+46 70 748 36 24"
  },
  "consultantName": "Joel Holmberg",
  "roleTitle": "Senior Javautvecklare och mjukvaruarkitekt",
  "profileParagraphs": [
    "Joel är en senior Javautvecklare och mjukvaruarkitekt med masterexamen inom computer science från KTH och över 14 års erfarenhet av mjukvaruutveckling. Han har särskilt stark erfarenhet av Java, Spring Boot, SQL, PostgreSQL, API-design, mikrotjänster och integrationsintensiva distribuerade system.",
    "Han har arbetat i miljöer med höga krav på spårbarhet, integritet, systemtillgänglighet, prestanda och testtäckning, bland annat inom bank och betalningar, e-hälsa, utbildning, kultur och startupmiljöer. Hans uppdrag omfattar backendutveckling, systemarkitektur, datamodellering, REST-API:er, CI/CD, loggning, kvalitetsstyrning och produktionsnära felsökning.",
    "Joel är en analytisk problemlösare med mycket god pedagogisk förmåga. Han sätter sig snabbt in i komplexa flöden, interna organisationer och tekniska stackar, bryter ner problem i tydliga lösningar och bidrar med arkitektur, implementation, kodgranskning, felsökning och kunskapsdelning i team."
  ],
  "selectedEvidence": [
    {
      "title": "Backendutvecklare - Bankgirot",
      "subtitle": "jan 2012 - dec 2016 - Stockholm",
      "summary": "Backendutvecklare i teamet bakom Swish, Sveriges största mobila betallösning. Ledde införandet av B2B-betalningar i en mikrotjänstarkitektur och arbetade med integrationer mot banker, handlare och Swish-supporten i en miljö med mycket höga krav på säkerhet, spårbarhet, testtäckning, upptid och prestanda."
    },
    {
      "title": "Backendutvecklare och arkitekt - We-U-Me AB",
      "subtitle": "okt 2021 - pågående",
      "summary": "Har bidragit från idé och förstudie till MVP och fortsättningsprojekt för en startup inom personlig assistans. Arbetet omfattar lösningsförslag, mjukvaruarkitektur, databasstruktur, backend- och frontendkod, PaaS, CI/CD, loggning, kvalitetsstyrning och stöd till yngre kollegor."
    },
    {
      "title": "Fullstackutvecklare - Riksförbundet FUB",
      "subtitle": "jan 2025 - jan 2026",
      "summary": "Byggde DigiVi, en webbapplikation för personer med funktionsnedsättningar. Skapade datamodell, backend och API:er i Java, Spring Boot och PostgreSQL, inklusive interaktiv Swagger-dokumentation och stöd för React-gränssnitt för flera användarroller."
    },
    {
      "title": "Arkitekt och fullstackutvecklare - Teknik i Väst",
      "subtitle": "jun 2019 - jan 2025",
      "summary": "Skapade arkitekturen för Techformance, en interaktiv teaterapplikation med flera React-gränssnitt, backend i Java och Spring Boot, WebSockets och PostgreSQL. Arbetet omfattade långsiktig arkitektur och utveckling för interaktiva flöden."
    }
  ],
  "competenceChips": [
    "Java",
    "Spring Boot",
    "Spring",
    "Mikrotjänster",
    "REST-API:er",
    "Swagger",
    "PostgreSQL",
    "SQL",
    "Datamodellering",
    "Systemdesign",
    "Integrationer",
    "IBM MQ",
    "CI/CD",
    "Docker",
    "Jenkins",
    "OpenShift",
    "AWS",
    "WebSockets",
    "JWT",
    "Liquibase",
    "JUnit",
    "Databasoptimering",
    "BlazeMeter"
  ],
  "projects": [
    {
      "title": "Backendutvecklare - Bankgirot",
      "subtitle": "jan 2012 - dec 2016 - Stockholm",
      "summary": "Joel arbetade som backendutvecklare i teamet bakom Swish. Han ledde arbetet med att införa B2B-betalningar i en mikrotjänstarkitektur och integrerade lösningen med banker, handlare och Swish-supporten. Uppdraget innehöll beredskap och akut problemlösning dygnet runt i en miljö med mycket höga krav på säkerhet, spårbarhet, testtäckning och robust drift.",
      "skills": [
        "Java",
        "Spring",
        "Mikrotjänster",
        "Jenkins",
        "Docker",
        "IBM MQ"
      ]
    },
    {
      "title": "Backendutvecklare och arkitekt - We-U-Me AB",
      "subtitle": "okt 2021 - pågående",
      "summary": "Joel har varit med från idé och förstudie till MVP och fortsatt utveckling för en startup inom personlig assistans. Han har bidragit med lösningsförslag, mjukvaruarkitektur, databasstruktur, backendkod, frontendkod och UX-design samt arbetat med PaaS, CI/CD, loggning och kvalitetsstyrning.",
      "skills": [
        "Java",
        "Hibernate",
        "PostgreSQL",
        "Datamodellering",
        "CleverCloud",
        "CI/CD",
        "Loggning"
      ]
    },
    {
      "title": "Fullstackutvecklare - Riksförbundet FUB",
      "subtitle": "jan 2025 - jan 2026",
      "summary": "För DigiVi skapade Joel datamodellen, backend och API:er för en webbapplikation som hjälper användare med funktionsnedsättningar att hitta vänner och partners och lära sig om relationer. Backend byggdes med Java, Spring Boot och PostgreSQL och stödjer React-gränssnitt för slutanvändare, administratörer och superadministratörer.",
      "skills": [
        "Java",
        "Spring Boot",
        "PostgreSQL",
        "Swagger",
        "REST-API:er",
        "React.js"
      ]
    },
    {
      "title": "Arkitekt och fullstackutvecklare - Teknik i Väst",
      "subtitle": "jun 2019 - jan 2025",
      "summary": "Joel skapade arkitekturen för Techformance, en interaktiv teaterapplikation där deltagare påverkar vad som händer på scenen. Lösningen använde React för flera gränssnitt och Java/Spring Boot för backend, med WebSockets och PostgreSQL för interaktiva flöden.",
      "skills": [
        "Java",
        "Spring Boot",
        "WebSockets",
        "PostgreSQL",
        "React.js",
        "Arkitektur"
      ]
    },
    {
      "title": "Fullstackutvecklare - Dit-i-tid",
      "subtitle": "jan 2020 - dec 2024",
      "summary": "Joel skrev majoriteten av koden för Dit-i-tid, en aktiv påminnelsetjänst med fokus på kognitiva funktionsnedsättningar. Tjänsten byggdes med Java, Spring Boot och Angular/TypeScript/JavaScript och hostades på AWS, med REST-API:er, JWT, Liquibase och tillgänglighetsanpassningar.",
      "skills": [
        "Java",
        "Spring Boot",
        "REST-API:er",
        "JWT",
        "Liquibase",
        "AWS",
        "Angular"
      ]
    },
    {
      "title": "AI-stödd utveckling - ViewMe",
      "subtitle": "jan 2026 - apr 2026",
      "summary": "Joel ledde ett initiativ för AI-stödd utveckling med Cursor och relaterade verktyg. Arbetet omfattade boilerplate för DTO:er, mappers och controllers, refaktorering, JUnit-testgenerering, felsökning, dokumentation av legacy-kod, SQL-generering, databasoptimering, API-kontrakt och best-practice-analys.",
      "skills": [
        "Cursor AI",
        "AI-utvecklingsverktyg",
        "JUnit",
        "SQL",
        "API-kontrakt",
        "Databasoptimering"
      ]
    },
    {
      "title": "Apputvecklare och produktägare - Resledaren",
      "subtitle": "jan 2013 - dec 2015",
      "summary": "Efter en hackathonvinst byggde Joel en app med Xamarin som genererade iOS- och Android-appar för app stores. Appen hjälper användare med autism att resa med tåg och buss lättare och hade höga krav på teknisk tillgänglighet.",
      "skills": [
        "C#",
        "Xamarin Android/iOS",
        "Android SDK",
        "MVVM",
        "Push notifications"
      ]
    }
  ],
  "skillLevels": [
    {
      "level": "Expert",
      "skills": "Java, Java 8, backendutveckling, mikrotjänstarkitektur, prototyping och WCAG-medveten utveckling."
    },
    {
      "level": "Mycket hög kompetens",
      "skills": "Spring Boot, Spring, SQL, PostgreSQL, datamodellering, REST-API:er, Swagger, WebSockets, Hibernate, Liquibase, Git, integrationer, CI/CD, tillgänglighetstestning och tillgänglig kod."
    },
    {
      "level": "Hög kompetens",
      "skills": "Docker, Docker Compose, Jenkins, OpenShift, AWS, Heroku, CleverCloud, IBM MQ, JWT, MapStruct, JHipster, Scrum Master-stöd, React.js, TypeScript, Angular, Material UI och BlazeMeter."
    },
    {
      "level": "Ytterligare kompetens",
      "skills": "Cursor AI, AI-stödd utveckling, AI-utvecklingsverktyg, Atlassian Rovo AI, C#, Xamarin Android/iOS, Android SDK, .NET och JIRA pluginutveckling."
    }
  ],
  "certifications": "Oracle Java SE 8 Programmer, 2012. Master in Computer Science and Teaching, Kungliga Tekniska högskolan (KTH), Stockholm, 2007-2012.",
  "languages": [
    {
      "language": "Svenska",
      "proficiency": "Modersmål"
    },
    {
      "language": "Engelska",
      "proficiency": "Flytande"
    }
  ],
  "labels": {
    "contact": "Kontakt",
    "selectedEvidence": "Utvalda projekt",
    "relevantCompetence": "Tekniker",
    "projects": "Projekt och uppdrag",
    "skills": "Kompetenser",
    "certifications": "Kurser, certifieringar och utbildning",
    "languages": "Språk"
  }
}
